web-scraper-order,web-scraper-start-url,review,header,date
1749061575-63,https://www.amazon.com/product-reviews/B00313J7JS/,"Awesom, I couldn't be happier! It writes like you've a quill and ink...without the bleed through your paper. (Even on thin parchment) I'll definitely buy this again.

The tip stays fine even after full use. A lower price would be better because the pen doesn't last that long, but I do still find it worth buying.",,
1749061575-64,https://www.amazon.com/product-reviews/B00313J7JS/,I love this! I got the medium tip. The size to me is about midway between tombow fudensuke and tombow dual tip. The tip is shorter and somewhat firm so it is easier to control. The grip on the pen is a nice touch.,,
1749061575-65,https://www.amazon.com/product-reviews/B00313J7JS/,this is a good deal for what I'm using it for,,
1749061575-66,https://www.amazon.com/product-reviews/B00313J7JS/,My daughter purchased this for my son as a christmas gift. He loves it! We ended up order another one to keep on hand for him.I posted a picture he used the pen on.,,
1749061575-67,https://www.amazon.com/product-reviews/B00313J7JS/,"Awesome pen. When I saw that it was actually coming from Japan, and it had a long lead time I was concerned. However, it arrived like 2 weeks ahead of the estimated delivery date! And of course, it was in perfect condition and is the pen I wanted. So good deal all around!!",,
1749061575-68,https://www.amazon.com/product-reviews/B00313J7JS/,"This thing is great, and it doesn't smell. It creates really stylish lines for being inexpensive. It actually gives manga or any other drawing/writing the sense of authentically being Japanese. It will never replace a real brush and ink, mind you, but it does look good.",,
1749061575-69,https://www.amazon.com/product-reviews/B00313J7JS/,"I found this pen to have a surprisingly hard tip to it. No complaints here, just didn't expect it.",,
1749061575-70,https://www.amazon.com/product-reviews/B00313J7JS/,I love it I use it for line art. The tip is a little weird but I got used to it,,
1749061575-71,https://www.amazon.com/product-reviews/B00313J7JS/,Sign making on an artistic mode..,,
1749061575-72,https://www.amazon.com/product-reviews/B00313J7JS/,"Great brush. I use it to draw hair. Can go from really thin to nice and thick with just a bit of pressure, and it does look like a real brush.",,
1749061575-73,https://www.amazon.com/product-reviews/B00313J7JS/,making cards or writing letters this is a great pen,,
1749061575-74,https://www.amazon.com/product-reviews/B00313J7JS/,It works well with my manga beta.,,
1749061575-75,https://www.amazon.com/product-reviews/B00313J7JS/,"Still holding up after many uses, good quality for the price",,
1749061575-76,https://www.amazon.com/product-reviews/B00313J7JS/,Love these felt pens. The brush stays neat and tight while writing. I also like how deep the color black is. My go-to pens!!,,
1749061575-77,https://www.amazon.com/product-reviews/B00313J7JS/,I love it.  Writing in kana and kanji takes a whole new look and looks more like the examples I am learning from,,
1749061575-78,https://www.amazon.com/product-reviews/B00313J7JS/,I thought by the description of this pen as a ‘brush’ tip it would be flexible and it is not. It is very hard and firm.,,
1749061575-79,https://www.amazon.com/product-reviews/B00313J7JS/,Nice product sealed in factory package. Ink ran a little dry.,,
1749061575-80,https://www.amazon.com/product-reviews/B00313J7JS/,I've greatly enjoyed this pen for lettering. The ink flows great!,,
1749061575-81,https://www.amazon.com/product-reviews/B00313J7JS/,"This pen is a very fine line, although I would still like a finer line for writing on rice. This does show up well.",,
1749061575-82,https://www.amazon.com/product-reviews/B00313J7JS/,The grip is great and so is the expressive tip. Ink is awesome. Feels good to write and draw with,,
1749061575-83,https://www.amazon.com/product-reviews/B00313J7JS/,Love these! Love the flexibility of the nib - it’s just right!,,
1749061575-84,https://www.amazon.com/product-reviews/B00313J7JS/,"The ink brush is great for calligraphy and painting on paper, canvas, silk, parchment and other media.",,
1749061575-85,https://www.amazon.com/product-reviews/B00313J7JS/,"I was expecting more of a soft brush tip, but the tip is really hard :/",,
1749061575-86,https://www.amazon.com/product-reviews/B00313J7JS/,"Not bad.  I'm not a huge fan of the tip, but to each his/her own.",,
1749061575-87,https://www.amazon.com/product-reviews/B00313J7JS/,"These things flow great, my favorite!",,
1749061575-88,https://www.amazon.com/product-reviews/B00313J7JS/,"Great pen, if a little thicker than expected. However I left the lid off over the weekend and it dried out. User error to blame.",,
1749061575-89,https://www.amazon.com/product-reviews/B00313J7JS/,One of the best writing pens for someone who likes a bold style with lots of versatile uses.,,
1749061575-90,https://www.amazon.com/product-reviews/B00313J7JS/,"I'll be buying again! Its really nice and works perfect, my friends that do art and calligraphy want one",,
1749061575-91,https://www.amazon.com/product-reviews/B00313J7JS/,"A very nice quality pen. Writes smoothly. Unfortunately the cap fell off and got lost, so I can't say how long it lasts.",,
1749061575-92,https://www.amazon.com/product-reviews/B00313J7JS/,is very good,,
1749061575-93,https://www.amazon.com/product-reviews/B00313J7JS/,"Love this pen, will be making this purchase again and the price was right!!! Shipping a little slow as it came from outta country....",,
1749061575-94,https://www.amazon.com/product-reviews/B00313J7JS/,"Foam tip, not brush. One of my favorites although it is stiffer than a brush. But you can make thick and thin lines with it.",,
1749061575-95,https://www.amazon.com/product-reviews/B00313J7JS/,Wish I knew about these pens earlier. Excelent brush control.,,
1749061575-96,https://www.amazon.com/product-reviews/B00313J7JS/,this pen is definitely for beginners buts that's why I love it!! great quality writing.,,
1749061575-97,https://www.amazon.com/product-reviews/B00313J7JS/,"it has a felt tip that's not too flexible, and it's ideal for more detailed work.",,
1749061575-98,https://www.amazon.com/product-reviews/B00313J7JS/,"Fantastic brush pen! It has such a fine tip and smooth, even stroke! I'm in love!",,
1749061575-99,https://www.amazon.com/product-reviews/B00313J7JS/,The tip of the pen was leaking when I received it in the mail.,,
1749061575-100,https://www.amazon.com/product-reviews/B00313J7JS/,This felt tip pen was great. Really enjoyed it.,,
1749061575-101,https://www.amazon.com/product-reviews/B00313J7JS/,"I love the size of it, and the ink flows.",,
1749061575-102,https://www.amazon.com/product-reviews/B00313J7JS/,Highly Recommended.,,
1749061575-103,https://www.amazon.com/product-reviews/B00313J7JS/,Fantastic,,
1749061575-104,https://www.amazon.com/product-reviews/B00313J7JS/,Great pigmented pen to do lettering,,
1749061575-105,https://www.amazon.com/product-reviews/B00313J7JS/,Fabulous super black pen.  Great for artwork,,
1749061575-106,https://www.amazon.com/product-reviews/B00313J7JS/,This is fabulous! My daughter loves it. Thanks! Highly recommend.,,
1749061575-107,https://www.amazon.com/product-reviews/B00313J7JS/,"The brush pen came directly from japan, my daughter loved it, for manga sketching",,
1749061575-108,https://www.amazon.com/product-reviews/B00313J7JS/,Good grade for skill writing.,,
1749061575-109,https://www.amazon.com/product-reviews/B00313J7JS/,"Low quality ink, runs out quickly. The brush and grip are nice, but it's definitely more suited to writing or calligraphy than it is to drawing.",,
1749061575-110,https://www.amazon.com/product-reviews/B00313J7JS/,Another great product to add to my art stash!,,
1749061575-111,https://www.amazon.com/product-reviews/B00313J7JS/,Amazing pen!!,,
1749061575-112,https://www.amazon.com/product-reviews/B00313J7JS/,Totally awesome!,,
1749061575-113,https://www.amazon.com/product-reviews/B00313J7JS/,"I wouldn't be surprised if this pen was already used, or a few years old. The ink is so dry every line you write looks faded. Looks better in pictures, very cheap plastic, lightweight. Disappointed to find out the pen is non-refundable. What a waste.",,
1749061575-114,https://www.amazon.com/product-reviews/B00313J7JS/,My daughter loves it.,,
1749061575-115,https://www.amazon.com/product-reviews/B00313J7JS/,Great product!,,
1749061575-116,https://www.amazon.com/product-reviews/B00313J7JS/,Superb!,,
1749061575-117,https://www.amazon.com/product-reviews/B00313J7JS/,Like this very much.,,
1749061575-118,https://www.amazon.com/product-reviews/B00313J7JS/,Love it.,,
1749061575-119,https://www.amazon.com/product-reviews/B00313J7JS/,Ran out of ink in just a few uses. Not sure if I received an old one? Or if the ink is supposed to be light scratchy/light in pigment. Not happy with this purchase.,,
1749061575-120,https://www.amazon.com/product-reviews/B00313J7JS/,awesome pen,,
1749061575-121,https://www.amazon.com/product-reviews/B00313J7JS/,"i did not like this at all!!! There is hardly any ink and did not leave clean lines, instead my lines were broken up as if the ink was almost out! Would not recommend to anyone!",,
1749061575-122,https://www.amazon.com/product-reviews/B00313J7JS/,"It came dry, barely can write. Very stiff brush & no ink.... What's the point? Sham!",,
1749061575-123,https://www.amazon.com/product-reviews/B00313J7JS/,does not write. no ink came out,,
1749061575-124,https://www.amazon.com/product-reviews/B00313J7JS/,The tip is NOT a brush! Just a marker-like hard tip!,,
1749061575-125,https://www.amazon.com/product-reviews/B00313J7JS/,"The ink of the pen flows nicely, and does not actually bleed through the paper unreasonably. I do admit, I am scared to apply as much pressure as I would like to practice some calligraphy, and so I am not reviewing it for that.

If I were reviewing this for something it is not, a brush pen, it would obviously be a 3-star-review, because nothing can really replicate a brush, but I am reviewing this as a felt-tipped pen and a ball-tipped-pen, and it is nice!

The pen cap is clear and doubles as an okay-stand, so the brush can be set vertically, and brush can even be hung due to a cord on the bottom. If you are a person who likes putting the cap on the bottom of the pen for writing, the cap can even do that.

I tested this pen on three surfaces I usually write on, which are off-brand graph paper, off-brand 3x5"" note cards, and off-brand loose-leaf-notebook-paper, and of these all, the notebook paper is where it shewed--smoothness and ink transfer at a quick-pace. I normally prefer writing on notecards due to their sturdiness and smooth writing surface, but, unlike a ballpoint, this pen had a lot of drag on the notecard and honestly would be good if one writes slowly on the notecard, say for flash cards, and I do say, I enjoyed writing slowly on a note card with it.",,
1749061575-126,https://www.amazon.com/product-reviews/B00313J7JS/,"I own many different fude brush pens for drawing and calligraphy (western, not Japanese). This series by Kuretake is one of my favorites. The tip is flexible enough for easy stroke variation, but firm enough to make consistent hairlines when needed. The ink delivery is perfectly calibrated to the speed and pressure of your hand movements -- juicy when needed, light and airy when going in for tiny strokes. And unlike a lot of hard-tipped fude pens, there's very little scratchiness when using the side of the nib for broader lines. I really enjoy working with this one.",,
1749061575-127,https://www.amazon.com/product-reviews/B00313J7JS/,Good for calligraphy,,
1749061575-128,https://www.amazon.com/product-reviews/B00313J7JS/,"I’ve tried about a half a dozen different pens, and this one is my favorite. The rubber grip is just a little wider; enough to make this pen more comfortable. And the length is a little longer than most. Most important, though, is that this pen writes very nicely; very clean lines and glides across the paper smoothly.",,
1749061575-129,https://www.amazon.com/product-reviews/B00313J7JS/,"No utilizo el Kuretake Bimoji para lettering sino para entintar dibujos o hacer lo que llaman ""urban sketching"", o lo que es lo mismo, dibujar en la calle lo que estás viendo en ese momento, rápido, con trazo ligero... (que por cierto, os recomiendo que probéis esta actividad alguna vez, despeja la cabeza mejor que cualquier psicólogo). Bueno, al lío, el entintador responde muy bien a la presión e inclinación, pudiendo jugar con ello y poder así realizar trazos desde muy finos hasta relativamente gruesos y también realizar esas lineas de fino a grueso típicas del lettering, y a mi tanto me gustan para dibujar. En mano me resulta cómodo y agradable.  Es un poco carillo, pero de vez en cuando salen ofertas por debajo de 5 euros que tampoco es tanto, ya que dura bastante. En definitiva, el ""Kuretake Bimoji"" es uno de mis entintadores preferidos.",,
1749061575-130,https://www.amazon.com/product-reviews/B00313J7JS/,,,
1749061575-131,https://www.amazon.com/product-reviews/B00313J7JS/,"Really useful I bought this and all the others variants. The ink is super black and clear, and doesn t ruin the other side of the page. 5 stars",,
1749061575-132,https://www.amazon.com/product-reviews/B00313J7JS/,,,
1749061575-133,https://www.amazon.com/product-reviews/B00313J7JS/,,,
1749061575-134,https://www.amazon.com/product-reviews/B00313J7JS/,,,
1749061575-135,https://www.amazon.com/product-reviews/B00313J7JS/,,,
1749061575-136,https://www.amazon.com/product-reviews/B00313J7JS/,,,
1749061575-137,https://www.amazon.com/product-reviews/B00313J7JS/,,,
1749061575-138,https://www.amazon.com/product-reviews/B00313J7JS/,,,
1749061575-139,https://www.amazon.com/product-reviews/B00313J7JS/,,,
1749061575-140,https://www.amazon.com/product-reviews/B00313J7JS/,,,
1749061575-141,https://www.amazon.com/product-reviews/B00313J7JS/,,,
