web-scraper-order;web-scraper-start-url;review;;
1749059567-40;https://www.amazon.com/product-reviews/B005WPTTG4;"I think this is my new favorite pen for taking general work notes and reminders for myself. Among fountain pens there are certain ones which seem to have no direct completion. This one and the Platinum 3776 (which makes using carbon black ink practical), for example. This Med VP is the smoothest writing pen I've ever used, except for the Uniball Jetstream, which isn't a fountain pen anyway. Some people might feel that springy nibs are smoother, however. I'm not a big fan of the Pilot cartridge black because it's more of a watery dark grey. I'm using Aurora Black with the converter, which doesn't hold much ink. I went to Baltimore Pen show (2020) and tried out lots and lots of pens, but this one is the only one that I didn't already have in my small collection that shouted ""I'm way different!"" Since nothing had price tags I asked how much. I was testing a gorgeous light blue metallic model. When he said $150, I thought, think and read about this first. So, I did and then bought one here, but not the blue metallic which seems to be sold out everywhere so I went for this blue matte. Very pretty. I've read about the finish so I'm protecting it. I read the fine is not as smooth as the medium. so I got medium. The line is a scosh wider than what I think is perfect, but that's OK. Why so expensive? Well, the guts and nib inside which are very tiny and removable, to fill it, are $75 to replace as a part. So, the price has to start somewhere above that.";;
1749059567-41;https://www.amazon.com/product-reviews/B005WPTTG4;I have the Pilot Vanishing Point fountain pen in red with gold trim, <B> 18k nib.  It wrote immediately out of the box upon inking.  It writes very smoothly and reliably.  It is handy at work for taking notes standing, when dealing with a cap would be awkward, but also is a pleasure for long writing sessions at the desk.  I'm delighted with the pen.  I will say that although Japanese nib sizes tend to leave a thinner line than their Western or Chinese counterparts, this broad nib leaves as broad a line as any other.;;
1749059567-42;https://www.amazon.com/product-reviews/B005WPTTG4;"Unfortunatley I had to return the first one I received. The replacement is in transit. I LOVE the design, I love how practical it is. Who does not value a fountain pen that you can use  as a ball point? And this one is beautifull! The problem was it was too dry and I dared not do anything I was advised to do to increase the ink flow.  It worked well on the down strokes but not on the upstrokes. So, some letters could not be read.  Several people on the  fountain pen network had reported this symptom, but others are raving at the ink flow of the pens they have received. I will update this when I receive the replacement that so quickly AMAZON is sending, even before the UPS has picked up the non-working pen. Please look at the test writing for the problem. Maybe people with better knowledge of fountain pens could have fixed this, but I don't think it is my job to  tweek the pen. That would be tampering.  A 3 rate is  for design, workmanship and looks. The rest is to be seen and I will update next time i try the new replacement.

UpDATE:

After using the replacement for a for a month I can say that if your pen writes well, this is the most practical fountain pen in the world. The second pen I received skipped as well, but not as much, so I decided to keep it, although I was not satisfied with the buy.

I decided to fix the problem myself and by reading lots of references and tutorials, and changing the ink to Noodler's Oxblood and Black (I was using Diamine)  I was able to increase the flow. I also opened the tines with a  brass sheet.  None of these measures were aggressively pursued to keep risks at minimum, but finally i was able to say that it was close to being called a ""very good"" fountain pen.

NEXT PROBLEM surfaced after  a month with the second VP. The clip fell off!, just like that. No warning. I inserted it back and consulted with users and it seems it is a current problem. People are fixing it with ""G-S Hypo Cement"". I am still waiting for my cement to glue it back permanently. If I find anything else I will update the review. I still think if you are willing to fix it and put up with its defects , is a daily carrier and worth the risk. Should be priced lower for this, IMHO.";;
1749059567-43;https://www.amazon.com/product-reviews/B005WPTTG4;"I just bought my second Vanishing Point Fountain Pen. I have one in matte black that I got about 15 years ago. I loved it then and always wanted to get more. I just was unable to get one tell now. I was really happy to see this new pen come in the mail the very next day from the time I placed my order. Upon opening the packaging I could see that Amazon had packed everything together and I really liked that. I also was really happy that the box the pen came in was not damaged or crushed in anyway.

I proceeded to open the box the the Vanishing point pen was in and saw that it was much thicker then the Vanishing point that I have. I did not know if I was going to like this, but now that I have used it for almost a 3days now, I love it. It writes amazing, the Pilot Mixable Colour ink refills are wonderful in the pen even thou the packaging states it is for the Parallel Calligraphy Pens. I have not had any problems with the ink leaking or clogging up the nib on the fountain pen. Like I said I have only been using my new pen for 3 days now.

In a week or two I will post again.

I wanted to give you all an update on what I have learned from Pilot. They said, We recommend the use of our Namiki/Pilot ink to refill your pen. Its exclusive formula ensures proper long-term functioning of your writing instruments.  Other brands can damage and prevent the proper functionality of your pen, which inhibits your writing experience and voids your warranty.

With that I am still going to use the Pilot Mixable Colour in refills in my pen. So far they have been great. But I am doing what I feel is right for me and if you don't want to void your warranty then don't use them.";;
1749059567-44;https://www.amazon.com/product-reviews/B005WPTTG4;"I ordered this as I was looking for my next long-term fountain pen. Somebody recommended this one to me, so I decided to take the plunge and check it out.

I am extremely impressed with the pen's build quality. I have the black matte one, so it feels very sturdy, assuring, and comfortable. I know there's a clip down the barrel, but because of the way I hold my pen, I actually don't find it uncomfortable whatsoever. It feels perfectly fine for me when I write with it. I especially like how the clip is in a different place so the pen will be aiming upward whenever you have it clipped away in a pocket or something. I also like the added value of how the pen comes included with an ink converter, so if you have any ink lying around, you can load it up manually.

The pen is extremely versatile and portable. I carry it around regularly with my pocket notebook (a grid-dotted Leuchtturm1917), and I find that it works extremely well. Alongside that, I use it with another couple of notebooks. One is a CR Gibson journal that I use for organizing ideas for my stories and novels, and another is some off-brand notebook I use for studying other languages. It works well with all the paper that I've tried it on, with the exception of modern Moleskine paper. Of course, that's the fault of Moleskine themselves and not the manufacturers of this pen.

The pen feels quite sturdy, and I can say if you want a long-term fountain pen you can use for years to come, you will get an excellent value with this one. The best part for me is that I seriously feel like this pen makes me want to find excuses to use it. It just feels that excellent.";;
1749059567-45;https://www.amazon.com/product-reviews/B005WPTTG4;"There are many things to love about this pen, and a few that should be improved on.

Firstly, the most important question, ""does this pen write well?"" And the answer is yes! Very beautifully! This pen's writing abilities is amazing! It would be comparable to sliding a hot knife across butter, it's that smooth. And while it isn't a flex nib at all, you'll be surprised that it can give a little of a bounce to writing.
Also, who this pen is for is someone who wants to write on the go or do note-taking. With a fountain pen that doesn't need a cap to have to constantly post and recap, writing is super streamlined. Just pop it out, click the pen, write, and reclick, and you're all good to go.
Also, the pen itself is gorgeous to look at. I got the Blue with gold accents, and when I first took the pen out of the case, I marveled at it's beauty.

Now, here's what needs to be looked at. First, the Pilot converters are small. The pen will give you a good amount of ink to write with using a converter, to my taste, it should still be more. Cartridges are perfect at ink capacity for this pen.

Also, the click plunger gets scratched to all hell after a day's the first time. Because it's so long (the nib unit needs to be pushed a long distance) the scratches can be really lengthy, and a bit noticeable.

Would I recommend this pen? Absolutely, despite the few gripes I have about it. It really is a fantastic pen to write with, a joy to have around, and it's potability with the click mechanism is unmatched.";;
1749059567-46;https://www.amazon.com/product-reviews/B005WPTTG4;"I seem to have inadvertently become a pen collector--nothing too esoteric, mind you, just sleek, smooth-writing pen that balance well in the hand, please the eye, & work well where paper meets ink. The Namiki Vanishing Point does all of this & more. Its 18k nib is glorious; I love writing with it.  Fyi, tho, the ""fine"" nib runs a bit toward ""extra fine,"" by American & European standards, and so on with the other available nibs. Also, one of the reasons I may have had such a smooth go of it is, I think, because I recently discovered Iroshizuku ink, made by Namiki, which is the slickest (literally), prettiest ink I've ever used--& is certainly the ink made for Namiki pens. All in all it is a blissful experience. I love the sleek look; I love the way the writing instrument rests in my hand; I love the way it lays ink on the paper. & its packaging! What a hoot. I was tempted to keep the pen in its ""box"" as display. But I ended up using its ""box"" as a picture frame.  Best pen packaging ever!  This modern, innovative pen is a winner. Or at least it is one of my faves in my own growing collection.  Hope your experience is as positive as mine.

I have owned this pen two months now & come back to add, I still love this fountain pen.  The vanishing point mechanism that seals the nib away when you aren't using it protects the ink from drying out well.  My pen has never missed starting right up, even after a couple days of no use.  And the pen's reservoir must be decent sized.  I am still writing with the ink I put in 2 months ago, while I have had to refill every converter in my rotation of pens in the same period.";;
1749059567-47;https://www.amazon.com/product-reviews/B005WPTTG4;"This pen writes very well. It took a few weeks to feel as smooth as I expected, but after a short time it feels so smooth with Irishizuku black.

The fine is not quite as fine as I wanted, but writes extremely well. The ef is a tad too fine and often feels a little scratchy. For this reason while I prefer for the ef or vf nib in the Metropolitan, in the vanishing point the f is the way to go. The M is waaay larger, like 2 steps larger.

The two negatives would be small converter capacity, and the matte black clip scratches easily. It scratched literally the first day I carried it in a pocket- and doesn't touch up easily. The gloss finish seems more durable.
The small capacity is really small. Expect to refill every 4 full pages of writing.  With the ef nib I still need to refill almost weekly. I keep 2 pens in my bag just in case I ever run short on ink, but if that's a concern I'd use cartridges.

The 18k gold nib has a nice springy feeling, while giving a crisp line. The pen feels solid and hasn't leaked on me so far. Overall if you don't need the mechanism I'd buy a metropolitan to save money, otherwise you get what you'd expect in quality with Pilot.";;
1749059567-48;https://www.amazon.com/product-reviews/B005WPTTG4;The ability to extend and retract the nib with the ease of any ballpoint retractable is what makes this fountain pen so amazing for me. It makes writing with a fountain pen easy. I do not have to worry about taking the time to unscrew a cap, not lose the cap, worry about the cap falling off and causing a leak in my pocket. As far as leaks are concerned, this pen has not leaked an iota. I also own a Namiki Bamboo, which is also a great pen but it not conducive to day-to-day use since A) the cap is screw on/off and B) it leaks. This pen also weighs far less than my Namiki, though it does weight more than a comparatively sized ballpoint or felt tip. This is my go-to fountain pen. Sleek, stylish, and painfully easy to use. People don't even notice that I'm using a fountain pen - it's in and out that quickly and easily. The nib is stiff enough to give a dependable line, but flexible enough to not scratch up the paper I'm writing on. I've even managed to write on one of those cheap fast-food restaurant paper napkins with this pen. However, I will admit to being a bit too cavalier with the pen, as easy to use as it is. I have dropped the pen while the nib was exposed and this has bent it quite badly, however I have been able to bend it back into usable shape. If you are clumsy and careless like I apparently am, this may not be the pen for you since you will mourn for this pen. If you are careful enough to not drop the pen while the nib is exposed, this pen will make you very happy indeed.;;
1749059567-49;https://www.amazon.com/product-reviews/B005WPTTG4;This thing came and had a tag (Capless). After looking up multiple sources, it's VP. It's not Decimo for sure. Also I had a great price on this item (depending on the color and the nib option)! I read so much about this pen but wasn't so sure until I used them. The nib was so thin and small. It says 18K though it's impossibly small to read it with bare eyes. It has a heft and the holder is fine for my taste. This is all about the nib (bought Fine). I have 3 other high end Pilot pens so I have something to compare to. VP nib is very very smooth (like 823) yet so thin that it bounces beautifully. I'm not big on the nib variation but this springy and bouncy feel especially on such a thin nib is totally different experience for me. I now understand why people fall in love with this pen. Downside? There's no way to read the ink level. Though converter (that's built in) has a clear window, no matter what you do, the ink level won't show. So when it feels dry and ink doesn't flow as well, then, it's time to change. For me it was about 3-4 pages of casual writing on the legal pad. That's not whole a lot to write with. But on a very fine day, this fine pen will boost your mood. Trust me. It's a pen like no other. I may shoot for 2017 special.;;
1749059567-50;https://www.amazon.com/product-reviews/B005WPTTG4;"A fountain pen that's retractable is a pretty novel idea, and is the main selling point of the Pilot Vanishing Point.

The enlarged button atop the body alternates between revealing and retracting the narrow steel nib within.  The nib itself has a bulbous tip that's a nod at its ballpoint inspiration.  It's smooth and pleasant to write with.

I think the matte blue barrel paired with black details and trim is pretty classy.  The body and overall construction is metal and it feels solid and and well-made.  It unscrews in the middle allowing you to remove the convertor and nib assembly for filling- again, more similar to retractable pen than fountain pen.  Not having a cap to post, the clip is near the nib and makes it feel like you're writing with a pen that has a dorsal fin.  A little awkward, but not a deal breaker, and it keeps the nib pointing upward when clipped onto a pocket, etc.

Mine had some issues filling properly.  Tried submerging the entire black portion of the nib- which is a challenge since it's longer than most ink bottles are deep.  Replaced the converter.  Twice.  Still can't managed to fill the reservoir more than 15% or so.  It's probably a rare defect, but I don't like it enough to even bother with a replacement.

Tries to be the best of both worlds, but instead ends up with few of the advantages and most of the disadvantages of both.";;
1749059567-51;https://www.amazon.com/product-reviews/B005WPTTG4;I have this pen, fine nib, in three finishes that I rotate.  This is my go-to every day writing pen.  I like everything about it: the convenience of the retractable mechanism, the flexible nib, the fine low-bleed writing, the weight and balance in my hand.;;
1749059567-52;https://www.amazon.com/product-reviews/B005WPTTG4;"This is the most expensive pen I have ever owned, but it is also the best quality pen I have ever owned.
My handwriting is fairly small and anything but an extra fine nib allows the letters to run together.  This nib is actually one of the  best extra fine nibs I have found since it writes finer than most extra fine nibs.  I am currently using a carbon ink in it with wonderful results.  It starts writing with minimal or no strokes to get it started.  There are no problems with it skipping and this is a very smooth writing instrument. It glides over the paper (and quite a variety of papers at that) without scratching.  The retractable nib is extremely handy and so far has never allowed the pen to dry out.
It can be used either with cartridges or the included reservoir/ converter.  Some commenters have mentioned that the reservoir is fairly small.  I really have nothing much to compare to, but it holds plenty for my needs.
I really like this pen.  I can't afford to buy another, but neither do I want any other pen than this.";;
1749059567-53;https://www.amazon.com/product-reviews/B005WPTTG4;"This is my first retractable fountain pen, and well worth the investment.
The tank is a little small for heavy use, but perfect for signing documents , etc, during the week.
Takes some getting used to, as it looks like I'm using the pen upside down.
Ink flow is great, just the right amount of feedback on the page for me, but my husband finds it too slick.";;
1749059567-54;https://www.amazon.com/product-reviews/B005WPTTG4;"Consumer bias aside, I love the weight, feel, and look of this pen so much!

The sleek matte black of the pen makes it look so professional. I like the clip on the top/writing side because my fingers form perfectly right around it, the clickability of the pen makes writing a one-handed process (no capping or uncapping required), and it's the perfect size for my hand. The weight of the pen makes writing so enjoyable - in comparison, the Sailor Pro Gear Slim feels like a light toy.

My only qualm is that the converter that comes with the pen has a very low ink capacity. There are videos out there on how to get the most ink in the converter... but what I do instead is just fill up a cartridge with my favorite ink. It lasts much longer and is actually much less of a hassle than trying to fully fill the converter.";;
1749059567-55;https://www.amazon.com/product-reviews/B005WPTTG4;"This is a very nice pen, I would recommend getting it the fin nib just as the other reviews stated the writing would look more like the one with medium nib.

The pen is very clean and applies always same amount of ink, the writing is smooth and comfortable, and the pen also has some weight in it and settles very nicely into the hand.

The pen needs high quality paper where the writing will look almost fine and there will be no penetration to the reverse side of the page even if you write slowly as I do. on the other hand on paper such is the usual printer/Xerox paper the ink may not look quite as nice, while it does not ""feather"" the writing will look thicker.

I really really recommend getting the ink bottle from namaki and use the converter for your pen, the sole reason being that in my pen the converter was inserted so firmly into the nib unit that I was almost inclined to leave it alone and not use cartridge at all, as I was not sure how resilient the nib unit is. There is another reason as well the protrusion that is ment to brake the seal on the cartridge seemed to be plastic, while I would expect this part to be one of the strongest in the unit and made of high grade steel or equivalent, one again I cannot say for 100% but it really did look like plastic. Once I am out of cartridges I will get namaki cerulean blue ink and use that with converter.";;
1749059567-56;https://www.amazon.com/product-reviews/B005WPTTG4;"A gorgeous, functional everyday pen that is a bargain!  I always wanted a quality fountain pen without paying $1000+.  This one is perfect because:

1.  No screw-on cap.  No more fussing with a cap with both hands when looking for a pen to write with.  The pen opening has a little door that opens and closes, keeping the nib from drying out

2.  Pen is clipped with the nib pointing up.  No more little pen marks in my shirt pocket that even ball point pens can leave.

3.  Can be converted from piston filler to cartridge without problems.

4.  18K gold plated nib, long lasting, and looks great

However, I was a little disappointed that the design ""Carbonesque"" is actually just regular plastic with little dots painted on it.  Not the true carbon fiber look.  Also, when using a cartridge, it can take a long time for the ink to make its way to the tip.  Also when not used for a few hours, the ink at the tip dries and it takes about 15-20 seconds to prime the tip again.  A little annoying when you need to write something fast, like a phone number.

Overall, it's worth the $130 I paid for it.  I do agree that the medium tip should be used by most people for everyday use.  I got the fine tip and kinda regret it because with my handwriting, some of my lines are too thin and not very visible.";;
1749059567-57;https://www.amazon.com/product-reviews/B005WPTTG4;"Really love almost everything about the pen itself. The box was decent but i will say i feel somewhat cheated. The ""Fine Writing"" nib is not a fine nib. What i in turn received was a Medium Nib. That all being said i do enjoy the pen but i wish i had gotten what i had ordered.";;
1749059567-58;https://www.amazon.com/product-reviews/B005WPTTG4;"I have used inexpensive Pilot fountain pens for years.  They are sturdy, easy to hold, and write well.  I have never had one fail; but I do tend to leave them behind at restaurants or forget to retrieve them from people who have borrowed them ""just for a second.""

When I saw a listing for this product I thought it was unique enough to give it a try.  I'm very happy I did.  The design of the pen is upside down; that is when in my shirt pocket the nib (nestled within the body of the pen) faces up.  Once I got the hang of that, it was an issue holding the pen (I'm left-handed) so that the nib was facing the page while the clip was out of the way.

The reality is:  The designers thought of this and, while I don't know how it works for righties; for lefties it is just fine.

The additional cost is well worth it.  The tiny nib writes far more easily than the budget Pilot, the mechanism hiding the nib works smoothly, and it didn't suffer from going with me on an airplane.

If I didn't own this pen, I would order one today.";;
1749059567-59;https://www.amazon.com/product-reviews/B005WPTTG4;"Ordered the pen in Matte Black with a Fine nib, received a Matte Blue with a Stub nib. Not really the fault of the seller, since the Pilot box states clearly that it contains a blue pen, whereas the Amazon sticker mistakenly labels it ""Black"".

Anyway, the pen itself is pleasant to use. I'll admit that the price point may be a little steep for the overall novelty, but I know what I paid for and I paid for a retractable fountain pen. The pen has a nice weight (for me), and I don't really mind the positioning of the pocket clip as I find it helps me align the nib without having to look. I could definitely see where some people might not like it, but in my hand it feels just fine.

Same general complaints as some other reviewers, however. The converter doesn't hold a massive volume of ink, and due to the construction of the pen it's just about the largest you could fit in it already so, not much to do outside of switch to cartridges. There is also some difficulty loading the thing up: when dipping into the ink, no matter how deep the pen goes, the converter only ever seems to pick up about 1/3rd of its total volume. This led to a few confused fill attempts where it looked like the pen wasn't picking anything up, but when inverted and given a small shake you see the ink fall down into the empty space.

Overall: A decent pen, if slightly more expensive than it should've been, with some small issues. My biggest complaint is that I didn't get the color or nib I ordered, which now means I need to buy a $90 nib assembly because there's no way to just swap the nib without it. But again: That's not the fault of the pen.";;
