web-scraper-order;web-scraper-start-url;review;;
1749059567-20;https://www.amazon.com/product-reviews/B005WPTTG4;"I was expecting to take at least a week to receive my order.  However, it only took three days.  I placed an order on the 17th, then it was shipped on the 18th, and I finally received it on the 20th.  Cool!

The product includes a conversion cartridge.  So, if you already have a bottle of ink, then just fill it up and it is good to go.  If not, it also includes a disposable cartridge.  A sheet of user's manual accompanies this product.

Pro:  No cap to worry about.  Click -- the nib comes out.  Click again -- the nib retracts.  Its built-in pocket clip makes it very easy to carry around.

Con:  Because of the way the pocket clip is located, it can become a source of discomfort since your index finger will be pressing against it.

I have been using two other fountain pen:  Waterman Phileas medium nib and Waterman Moonlight Hemisphere fine nib.  It took me a while before these two became responsive to my touches.  Pilot Vanishing Point, by contrast, did not need to be broken in at all.  I was able to write smoothly right after I filled up the conversion cartridge for the very first time.  Therefore, insofar as getting started:  Pilot Vanishing Point fine nib > Waterman Moonlight Hemisphere fine nib.  While Pilot Vanishing Point costs more than Waterman Phileas and Moonlight Hemisphere, I would recommend the former over the latter two.

******
Update:  04/24/2012

The twist converter cartridge included with the package can become a source of irritation:  It does not hold that much ink.  An additional source of irritation is that the transparent portion of the converter cartridge is obscured by the metal cylincer surrounding it.  I have noticed that some fountain pen merchants do carry squeeze cartridges for Namiki/Pilot brand fountain pens.  Based on user reviews, squeeze cartridge is superior to screw converter cap.  Unfortunately, Amazon.com is not one of them.

Update:  05/02/2012

5 stars minus 1:  The twist converter seems to be more than a minor nuisance.  Not only its capacity is rather limited (Waterman twist converter capacity is better, but cannot be adopted to Pilot), it does not seem to fit securely.  I have noticed that my pen has been leaking (although not severe enough to stain objects outside the outer casing).  I plan on purchasing a squeeze converter (Con-20) and see if this would solve two problems -- capacity and leaking -- in one go.  I will update this entry as soon as I start using it.

Update:  05/11/2012

Installed Con-20 squeeze converter.  No more leakage.  Better reservoir capacity.  Pilot should include Con-20 squeeze converter instead of Con-50 twist converter as part of its Vanishing Point package.  Why include a substandard converter while there is already a superior counterpart to otherwise a fine writing instrument?

As for the difference in the reservoir capacity between Con-50 and Con-20.  This has to do with the fact that it is next to impossible to completely remove the pocket of air lingering in Con-50 twist converter even after several consecutive draw/purge actions.  In short, its ink reservoir stays underutilized.

Update:  07/26/2012

Upon closer inspection, there are some leakage from the nib groove.  Although, I think this has little to do with mechanical problems.  I have been using Noodler's Black Eel ink and I remember reading something about other Noodler ink users having similar issues.  This leakage is nothing to worry about; it merely coats a part of the nib and does not lead to staining papers.  I wonder if other ink brands have this issue as well, although I will not be shopping for new ink any time soon.

Update:  12/11/2014

Good news: if you are looking for Con-20 converter, it can be found in Amazon.com.";;
1749059567-21;https://www.amazon.com/product-reviews/B005WPTTG4;I like that the pen is clicky, minus 1 point for the tip needing adjustment to flow properly out of the box;;
1749059567-22;https://www.amazon.com/product-reviews/B005WPTTG4;Although I was extremely upset about opening a used pen (there was drops of green ink in the cartridge), I absolutely love this pen! I usually use a Lamy Safari, and experiencing this kind of luxurious pen, I don't think I can ever go back. It fits perfectly in my hands and the weight is a welcomed feeling. The way the pen glides on the paper is beautiful, smoothest pen I've used. The ink does stay wetter for longer than I'm used to, but it's not a feature I was worried about. I know this will be my daily pen from now on.;;
1749059567-23;https://www.amazon.com/product-reviews/B005WPTTG4;"I got this as a Christmas present back in 2020, it’s been a daily driver since then. I tried a few inks with it (Waterman, Noodler’s) and settled on iroshizuku “tsuyu-kusa” - with a good quality paper, there is no bleeding and writing with it is an almost sensual experience. This gets five stars and I rarely give anything five stars.

Review Feb 2025 - still an amazing pen!! Consistently writes beautifully and the sensation on good paper is silky smooth. My favorite pen!";;
1749059567-24;https://www.amazon.com/product-reviews/B005WPTTG4;My Pilot Vanishing Point red and gold FP arrived well packaged and a day earlier than expected. I filled the pen with Noodlers 54th Massachusetts. This pen writes wonderful.  The pocket clip works well to position your fingers providing an anchor point. I ordered another Pilot, the Custom 743 Verdigris in EF along with ink samples and notebooks from the Goulet Pen company. Check them out;;
1749059567-25;https://www.amazon.com/product-reviews/B005WPTTG4;"Great pen.

Although it was shipped with the ink cartridge installed, so some kind of use. Also I had ordered a fine and they sent me a broad (in a box marked fine). So a little loose on the QC of what they were shipping.";;
1749059567-26;https://www.amazon.com/product-reviews/B005WPTTG4;"I'm relatively new to fountain pens, but I've been using a pair of medium priced Parker fountain pens daily at work and home for almost a year now, and they are great.  Work well, write smoothly, travel well, and none of the mess that I used to encounter as a child with my first fountain pens.  For Christmas though, I decided I was going to invest in a better quality pen to use daily.  I wasn't looking for a piece of art necessarily, but I wanted a professional looking pen that delivered a truly superior writing experience.  I write a lot in my work and I am in front of executives regularly.  I researched for some time the various manufacturers in the US, Europe  and Japan and read user reviews both pro and con. In the end I kept coming back to the Pilot Vanishing Point.  My other fountain pens are medium nib.  They write smoothly with good ink delivery, but I wanted a fine point.  I read several user references that said the Japanese make finer nibs, so that a Japanese medium is more like a European fine point.  I really wanted a fine point, but I decided to stick with a medium nib for the Pilot.  That turned out to be the right decision.  The nib on the Vanishing Point delivers ink with the smoothness of a medium but produces a fine line that dries quickly.  Absolutely no skipping or blotching. This pen frankly makes my not-so-neat handwriting look much more legible and professional even when writing quickly.
Mechanically, the Vanishing Point is amazing.  The engineering is flawless and works with a solid feel that inspires confidence that this pen will serve me well for a lifetime.  And as it turns out, it also looks like a work of modern art as an added bonus.  The rhodium accents are beautiful and the Carbonesque pattern on the barrel is striking, lending a subtle feel of texture to the grip.
My only complaint is with the delivery. The ink cartridge included with the pen exploded in transit and sent ink all over the inside of the case.  Fortunately, the pen was not affected and the Vanishing Point comes with a converter so I am able to use bottled ink.
The twist converter draws ink into the pen easily and with no inky fingers afterward.  A quick wipe of the nib and I was back in business.
I would recommend this pen to anyone who is looking to ""kick it up a notch"", especially if you're got a little bit of fountain pen experience and are hesitating to invest in a more expensive pen.  This one is well worth the price!";;
1749059567-27;https://www.amazon.com/product-reviews/B005WPTTG4;"I absolutely LOVE this pen.  I am neither a seasoned fountain pen geek, nor a first purchaser.  The reason I haven't used fountain pens prolifically has been two-fold: system portability and usage.  Addressing the later first, I love the feel of this pen!!  Very easy to write with mis-use, which makes this a phenomenal teaching tool; I consider it ""self-correcting"" when I place the nib incorrectly on the paper.  I have been trying to teach myself better penmanship; yet for work, I often need to note acronyms, sketch quick diagrams, etc.  This pen handles everything with ease.  Addressing system portability: I fill, on average, four to eight full page notes in my Moleskine notebook per day.  Some days zero.  I fly frequently, several times per month.  I was hyper-concerned about using this pen for work: potential leakage, ability to take notes quickly, ink reservoir in relationship to refill length, etc.  I clip the pen to Moleskine, and toss in my bag.  I half-heartedly try to ensure the pen is vertical, but the bag not so.  I have had zero issues.  I was concerned what pressure changes would do at altitude; no issues.  I was concerned about being to rapidly take a flurry of notes with no notice; zero issues.  I love this pen!!  It is my everyday always pen.  I currently try to fill it about every two weeks or so.  I've noticed about a 10-12 day refill cycle would be better, although it is based on a limited sample size.

I have had two issues:  I didn't care for the stock ink so I tossed the stock cartridge out of the box as I use Noodler's ink, the refill cartridge twist/plunger process took a bit to get used to. I spent the best part of a weekend practicing and writing and refilling and learning about it.  By Monday, I felt very comfortable with using the pen in all of the above scenarios.

The second issue I've had is minor: I bent the clip.  I was able to return to its original position; however, its not ""tight"" on the body.  Oh well.  It's minor to me.

I absolutely love this pen and has allowed me to get back to script writing on my pace, when I'm able to.  It always strikes up a conversation with observant customers.";;
1749059567-28;https://www.amazon.com/product-reviews/B005WPTTG4;"This was my very first experience with a fountain pen. I read a review and having always been a pen and pencil geek since I was a kid in 4th grade and got my first Cross pen & pencil set, I've always been looking for that Holy Grail of a writing instrument. I was always interested in fountain pens but I had two misconceptions, when I thought of fountain pens I thought, ""Oh, you have to dip them in ink or something? Sounds like a pain."" - and two...intimidation factor. Thinking about having to get inks, and thinking mess to clean up, no thanks. Anyway...

So I read about the VP. I thought, Wait a minute, it looks just like a regular pen, that's odd. And its a click fountain pen, like a regular pen. So I watched  a video or two, and I knew I had to have it. I got the fountain pen, it came with a cartridge converter (with which I had no idea of how to use it straight out of the box - obviously first fountain pen) and then two ink cartridges - which immediately was a relief  - I popped in the ink cartridge, bam! was immediately writing like a pro. I fell instantly in love with this fountain pen. I've had it a few months now. I've written hundreds of pages with it. I wouldn't trade it for any other fountain pen I have (or pen or pencil for that matter). Of course now I only use the cartridge converter and I have way too many bottles of ink that I love switching out all the time. Then there is the fact I now have 13 other fountain pens to vie for my attention - but if I know I'm going to be writing all day this is the pen I know that is going to be in my hand.

Warning: once you get hooked on fountain pens, its a long way down the rabbit hole chasing Alice and that crazy bunny rabbit

The Pilot Vanishing Point is definitely worth the money. Love it. Oh and the Matte Black...definitely the way to go. [I bought the medium nib, but you can buy separate nib units specifically for the Vanishing Point - so you can have a broad, a fine, medium, etc - so you don't have to buy multiple fountain pens - so it really makes the utility of this pen even more utility-ish]";;
1749059567-29;https://www.amazon.com/product-reviews/B005WPTTG4;so I am absolutely obsessed with this pen, the last three days were heaven. Satisfying click, amazing writing and truly enjoyable. Unfortunately, the pen stopped clicking within 3 days when I tried refilling the ink. I watched all “how to” videos and did everything I possible can. I am returning it and recording in hopes that I got a faulty pen and a piece fell out to make the contraption work! I cried trying to figure it out for three ours then gave up;;
1749059567-30;https://www.amazon.com/product-reviews/B005WPTTG4;"The convenience of this pen is nothing I'd have ever imagined from a fountain pen. As an owner of several high-end fountain pens that cost hundreds of dollars more than this pen, I'd have to say this pen is approaching the status of ""favorite"" among my collection. As a writer, I often jot down personal notes even as I'm at my computer. This pen eliminates the steps that I've been taking in the past to unscrew the cap, place the cap,  position the pen, etc. The clip, though right in the middle of the tripod of fingers for writing, acts as a guide for finger placement as to where the point of the nib will be. There's no more need to rotate the pen in your hand to get the correct writing angle as the clip helps to remind and position your hand for you. I'd actually say that this would be a great starter pen for anyone interested in the art of writing with a fountain pen.

Typically when using a fountain pen, I grip the pen closer to the nib than maybe I'd ought to leaving the tell-tale signs of writing stained on my fingers. With this pen, there's no chance of ink stain because the nib is shielded from any grip mishaps. Though the ink sac is small, I find that it is enough to take several pages of notes over the course of about two-three days. Part of owning a fountain pen is the small joy of refilling it. I haven't tried using the cartridge that came with it as I prefer to draw my ink from a bottle.

The quality of the pen seems to be pretty nice. Though the barrel doesn't exactly feel high-end, it is definitely sturdy and well made. The nib is firm but with enough flex. Some reviews that I've read about this pen made it seem that if you've got a firm hand when writing this pen might not be for you. I don't think that I accurate. Granted I don't try to poke holes in the pages when I write, I do find that this pen is firm enough for just about any type of handwriting style. I have not had any slips or dry spots on the page either even when writing softer or more firmly than I normally would.

I would buy this pen again.";;
1749059567-31;https://www.amazon.com/product-reviews/B005WPTTG4;"The original ""vanishing point"" in my small collection of fountain pens carries the Namiki brand name, though the parent is Pilot which is now the primary name for the new ""vanishing point.""

Although I had looked at catalog descriptions & pictures of the new model, it's taken a long time & a great deal to decide on trying this newer model.

If you are new to the vanishing point fountain pen, the name is really a clever way to describe the mechanism that extends & retracts the point with a push button just like a ballpoint pen. It's certainly ingenious. If you think that the point is exposed to the air when not in use, it's not--it's concealed by a clever internal flap. That means the ink doesn't dry out easily & stays fluid for a long period.

Now my personal feelings about the pen. As noted I have the previous model and the reader may benefit from a comparison. The original pen has beveled fluting which makes the grip comfortable and reduced slippage. The new pen is smooth. The older pen has a narrow barrel with a slimmer taper at the end where the shirt clip ends. The new pen is wider and heavier than the previous model.

This is not to say that I dislike the new model. If I was new to the vanishing point, I'd be perfectly happy. Since I can compare, I do prefer the feel of the older model as well as the design aesthetic, except for the color choices. The new model has nice colors & more variety. The color I chose is the  Blue Carbonesque with Rhodium and it is handsome though my expectation was for a darker hue. Nevertheless I am satisfied.  I had wanted to try a wide nib (which uses more ink) but it wasn't available at the time and so have the medium. It is fine and most of my fountain pens are medium nibs. The Pilot nib is smooth as silk.

The entire package is nice. Large heavy-duty case...one blue ink cartridge...a converter is included if you'd like to use bottle ink...instruction booklet. All in all, still a great product. Just think, you can write with a fountain pen without the bother of dealing with a cap. Fabulous.";;
1749059567-32;https://www.amazon.com/product-reviews/B005WPTTG4;"This is my second of the same model.  The first is just fine.  I just wanted to have another to travel with.

I really don't know what I can say as it is exactly as advertised.  It is a retractable fountain pen that can use bottled ink or prepackaged ink cartridges.  I've got a couple bottled inks, and the amount of money I've saved on ""disposable"" pens over the decade since I bought my first one of these probably has added up to the cost of it or surpassed it.

It writes great, and there isn't much maintenance that it needs to keep doing so.";;
1749059567-33;https://www.amazon.com/product-reviews/B005WPTTG4;"I just received this pen, but I can already tell it’s going to be one of my favorites.

It writes so nicely, looks and feels luxurious in my hand, and is exceptionally portable considering it’s a fountain pen.

The only thing I don’t like is how hard it is to fill the pen with ink using the converter that comes with it. I’d suggest just getting an ink cartridge instead if you write a lot and it bothers you.";;
1749059567-34;https://www.amazon.com/product-reviews/B005WPTTG4;"Overall, I really like this pen and after committing to using quality paper, it is my every day writer.  I've had mine for almost three years and am looking to purchase another one.  Wear issues/scratches with the matte black barrel is the only con.

Pros:
-The stock nibs are excellent (I've used the extra fine and medium and have settled on the medium).
-The balance and size (for my hand) is great.
-The convenience of no cap makes this versatile for intermittent use (taking notes for example).
-Griping around the clip does not bother me and actually serves as a tactile indication of orientation.  (I'm often annoyed by the lack of this indication in most capped fountain pens as there typically is axial symmetry in the grip area, though the nib requires a particular orientation.)  I concede that this is a matter of how you grip your pen and address a writing surface, so if you're unsure you should really try one.
-I have not had issues with the pen drying out, nor have I had any issues with filling/cleaning.
-I have not had leak nor ink on the hands issues.  (I should note that the ""trap door"" does rub on the nib and this seems to smear some ink around the nib itself and the ""door"".  These parts are recessed within end of the pen so any ""mess"" is contained and not touched with normal handling (excluding of course the nib, but you'd expect that to have ink on it right?).  If you're bothered just knowing there's a ""mess"" in there, then you might not want this pen; but then again there's a little vile of ink sloshing around in all fountains so fountain pens might just not be your thing.)

Con:
-I suggest avoiding the matte black barrel option.  Though I really like the low key look of the matte black, I've had wear issues.  The finish appears to be very ""soft"" and scratches easily.  (See photo.)  Admittedly, the photo shows wear after three years of regular carry and use, but it is not as though I leave the pen in my pocket with my keys.  Thus the -1 star and my perusing for the next most subtle color option that has a gloss finish.  (I'm guessing that the gloss finish will wear better.)";;
1749059567-35;https://www.amazon.com/product-reviews/B005WPTTG4;"This pen fits comfortably in my hand, though some people are apparently bothered by the placement of the clip - try before you buy or make sure you can return it.

The pen is heavier than some FPs, which I like - if you prefer feather-light pens, it may not be for you.

Bear in mind that this pen is ideally intended for jotting quick notes, as it allows easy one-handed operation; for this type of use, the clip and weight may not be much of an issue. They may not bother you much for a few minutes here and there. If you really need to write many pages, you will probably use a different pen anyway.

The nib is smooth and has good ink flow - among the nicest I have used. It feels a bit bouncy on the page (though it is not a flex nib) due to it's thin size and use of relatively soft 18k gold. Replacement nibs are cheap, so you can have different sizes; people like Richard Binder and John Mottishaw sell custom-ground nibs so that you can play with stubs, italics, and etc if desired. Very handy.

The only other caveat is that the ink capacity is relatively small, since much of the pen's internal space is taken up with the mechanism that allows the nib to be retracted. Once again, this should not be an issue if you are using the pen as a note jotter. For easy refilling on-the-go, Pilot's own cartridges can be used; for desk use, it is easy to refill the converter from an ink bottle.

All in all, a good pen for the money.

UPDATE, 8/15/14:
I bought a second one of these - Gunmetal finish, broad nib. This is one of only two fountain pen models of which I own two examples. (the other is the excellent and cheap Lamy Safari.) Compared to the medium nib, the broad is only slightly wider and is not as wide as a typical western broad (e.g., Sheaffer, Waterman). And the Pilot cartridges are the way to go: larger capacity than the converters and wonderful inks.";;
1749059567-36;https://www.amazon.com/product-reviews/B005WPTTG4;I really enjoy the pilot vanishing point. I have the broad point and the ink flows well, the pen does not scratch the paper and you can use reverse writing for a fine point feel. The click mechanism is satisfying and smooth. The pen has not dried out either which is nice. It’s a very classy pen and I’d buy another if I ever needed to.;;
1749059567-37;https://www.amazon.com/product-reviews/B005WPTTG4;I've ordered so many fountain pens because I didn't want to spend so much money at once.  If I added the cost of those pens, I could have purchased 2 vanishing point pens.  This pen is worth every single cent.  I'm saving for my next one so I can keep one in my purse and one for work.  It writes so beautifully.  Not one issue and it is a nice fine print.  Love it.;;
1749059567-38;https://www.amazon.com/product-reviews/B005WPTTG4;"Wow I love this pen. I’ve wanted one for a long time but didn’t know what size nib to get. I went with the fine because I usually like European extra fines. Japanese pens (Pilot) run smaller than European sizes. The fine is a little bit finer than I thought it would be based on pictures I saw online but I still love it. The extra fine would have definitely been too fine for me. The gold nib is super smooth.

For the people saying that they didn’t get a “Vanishing Point” but a “Capless”, the rest of the world sells this pen as the “Capless”. It is still a gold nib “Vanishing Point”. The “Capless Special Alloy” is the one with a steel nib and usually run about $80. For the record mine came in a box that says Vanishing Point.

Update: So I ended up ordering a second one in matte black extra fine. I really wanted to try the extra fine out as I’ve come to like a finer line for neat, clean looking writing. I love the extra fine and have used it more than my fine. But the EF does have considerably more feedback. It takes a few days of writing to get use to it. But I love both and have had zero issues with them.

I’ve seen some people call the retractable nib “gimmicky”. I disagree. I use my VPs much more than my other FP as it’s so much easier to click the nib out than unscrew a cap and screw it back on. I use it at work all the time as well as home. The only issue I can agree with is small ink capacity. However, this doesn’t bother me too much as I just refill the converter with an ink syringe once a week or so.";;
1749059567-39;https://www.amazon.com/product-reviews/B005WPTTG4;"I have a small mountain pen collection. I wish I would have bought this pen first. This would have been my only fountain pen. I use this everyday, for everything. Journaling, work meetings.

All black pen, so sexy pen
You can tell the pen is made from high quality materials.
But the ability to just click the pen, and begin/stop the writing process, protect the gold plated nib, with just a click, wonderful.

The most practical pen for me. If this one ever breaks, I will buy another one.";;
