web-scraper-order;web-scraper-start-url;review;;
1749059567-85;https://www.amazon.com/product-reviews/B005WPTTG4;"I have quite a few fountains pens, from my expensive Mont Blanc to my less expensive ""Preppy"" plastic model.  Previously (believe it or not) the plastic-bodied Preppy has been my workhorse, with the smoothest flow and nib on any pen I've used.  Not bad for a $10 pen.  However, the plastic body breaks down fast, and the point is too broad.

I'd been reading about the Vanishing Point for quite a while, and I finally managed to pick this one up.  All I can say is WOW.  This is finest point I've ever written with.  The lines are EXTREMELY thin, and the nib is pretty smooth.  It's not as smooth as my Preppy (or my Rapidograph), but it's pretty smooth, and the feel of it is nice and substantial, like a good pen should be, without being too grossly heavy.  I've used the cartridge (Pilot Namiki brand) and the convertor (with Noodler's Bulletproof Black) and both work equally well.  I did about 9 pages of longhand with the convertor, though, and it sucked the convertor dry, so keep your ink handy if you write a lot.

The contours are also well-done, with the pocketclip having small depressions for your fingertips while holding it, and the guts are very well-built.

Extremely good value in this pen.";;
1749059567-86;https://www.amazon.com/product-reviews/B005WPTTG4;"I absolutely LOVE the spectacular stub nib for this pen!

Like Pilot's great Fude nib you can adjust line width by tilting the pen. Holding the pen vertically gets you a fine italic, hold it at 60 degrees and you get a medium italic!!!

Additionally this gold nib, small as it is, is springy and gives you a lot of expressive width changes with gentle changes in pressure.

The mechanism seems well sorted and reliable.

The pen is stealth to the max, and only fountain pen junkies will give it a second look, which is fine with me. It is the secret handshake of our clandestine family.

A medium wet very smooth writer, and not a terrible deal for a 18K gold nib pen (the nib is also stealth in mat black!)

Thinking of a retractable, but in love with stubs?

Your pen has arrived!";;
1749059567-87;https://www.amazon.com/product-reviews/B005WPTTG4;I love this pen, only reason I'm giving a 4/5 is because it feels alittle heavy in your hand, and where the clip is at almost makes you have to hold it a certain way. I love the fine point because I tend to write small, and I love the sound the nib makes on paper when you are writting. If they could lighten it up just a touch I would give 5/5 all day;;
1749059567-88;https://www.amazon.com/product-reviews/B005WPTTG4;I have numerous fountain pens for writing in my journals.  This one is the one I always seem to look for when it's time to write some mothereffing feelings or ideas down.  This pen, with a standard converter, accompanied by some Noodler's Heart of Darkness black ink, and used upon a sturdy Blue Line notebook, and I can't go back to any other combination.  My poor Lamy collection watches me with contempt every time I pass by their case, and I can hear them consoling each other in the middle of the night when they think no one is listening.  This pen has me wanting to just waste more money on getting the same pen in different colors, it writes so smooth and easy.  I like a smaller line, so I use a Fine, but this is kind of like a medium/fine in my opinion, which is just about right for my taste.  I've gone weeks without using it, and when I put it to paper, its primed and ready upon the first stroke.  Get yourself one of these.  You'll like it.  Just don't take it to work and waste it on job stuff.  Use it to actually write something personal on some good paper and you won't feel cheated.;;
1749059567-89;https://www.amazon.com/product-reviews/B005WPTTG4;Simple review, the fit and finish are 2nd to none. The detailed engineering, that went into the use of this pen, make it user friendly from refills to writing with the pen. To me it is priced, very justifiable for the advanced fountain pen your are receiving. Do yourself a favor and purchase this pen, with the pilot brand refill bottle. Even the bottle is filled with just enough ink to lightly rest your pen tip on bottom for a clean refill. Plus the ink is incredibly fast to dry and maintains a deep color. I purchased 2 of these pens, and both were flawless. The packaging was very detailed, so the look and quality feel of the packaging match the quality of the pen. I write on the small side, but pretty neat do to private school IMHO. So I found the fine tip to be the perfect size line width, for all my writing needs from documents to journals to greeting cards. I hope the review helps you. God bless all of us.;;
1749059567-90;https://www.amazon.com/product-reviews/B005WPTTG4;Beautiful pen writes like butter;;
1749059567-91;https://www.amazon.com/product-reviews/B005WPTTG4;"Update: I decided to buy another girl pen, the extra fine bib and the fine nib. (See picture). I love the fine bib. It flows great and gives you clean ink across the page. The extra fine gets snagged on the paper. I like how thin the ink flows but it literally drags across the paper.

I am a lefty and this is my first fountain pen. I absolutely love it. It is smooth but also allows me to change the position of writing when my hand gets tired. I can write at an almost 90 degree angle to a 45 degree angle and the ink continues to flow. The clip allows me to rest my pointer finger comfortably. I have a tendency to use a lot of pressure to write and this pen makes it so I can use a light pressure. I’m curious what the other nibs feel like. I ordered a fine point.";;
1749059567-92;https://www.amazon.com/product-reviews/B005WPTTG4;Great writer.  I love medium nibs and this didn't disappoint.  The clip on the end doesn't bother me at all while I'm writing, but I wouldn't use this long writing.  I take a lot of pleasure knowing the Pilot Vanishing Point nib units are interchangeable with other Pilot capless pens.  Also, it comes with a blue ink cartridge, and converter.  Matte black look has that professional look, too.;;
1749059567-93;https://www.amazon.com/product-reviews/B005WPTTG4;In case you were wondering like I was, I asked what nib does “fine writing” refer to. I wasn’t given the correct answer and ordered the pen. When it arrived it was a broad nib. Not what I was looking for and will need to send the pen back. Hope this saves someone some time.;;
1749059567-94;https://www.amazon.com/product-reviews/B005WPTTG4;"Although I own quite a few fountain pens, this is my first $100+ pen purchase. I was nervous to spend so much on a pen, but after drooling over this pen for so long and reading all of the wonderful reviews I decided to go for it.  I am so glad I did!  The quality of this pen compared to my others is amazing. (You truly do get what you pay for.)

I decided to purchase the medium nib because I do not like the scratchy feeling you sometimes get with finer nibs.  It's perfect for me - very smooth on the paper, and it distributes just the right amount of ink.  The retractable feature is wonderful. With a satisfying click, my nib is put away and protected. I also like the placement of the pen clip because it guides my fingers into perfect writing position.  It just ""feels right"".

Whether you are a newbie or a veteran fine pen purchaser, you will not be disappointed with this pen. It is such a joy to write with and a quality instrument.";;
1749059567-95;https://www.amazon.com/product-reviews/B005WPTTG4;"I have two of these and they are great daily writers due to the convenience of not having to handle a cap. it does not look very elegant like other famous brands of fountain pens. nevertheless, I like the utilitarian look. the strange way of holding on to the clip doesn't bother me.

I have both the medium and broad nips. they both are very ""wet"" nips. very smooth gliding on even the cheap Xerox papers when the right ink is used. I have always used bottled ink.

I noticed that they work best with the pilot ink, especially with the Iroshizuku line. aurora, waterman, and diamine bottled ink work well as well. However, I don't have luck with Noodler's indelible ink with the pilot vanishing point.

the pilot (Namiki) are quite consistent with the ink they prefer. the sterling and the falcon series behave the same way. when the right ink is out in them, they have a very generous ink flow and are very pleasant writers.

the vanishing point pen, has an excellent seal when retracted; even after being stored for a couple of weeks, the nip does not get dried out.";;
1749059567-96;https://www.amazon.com/product-reviews/B005WPTTG4;"Purchased the Pilot VP in red/gold with the fine nib, really writes well.  This pen is more burgundy than red, I was hoping for red as pictures sometimes don't display the true colors.  Most reviews of this pen are right... quick list of points below that I plan on adding more later:

* con-50 converter included does not hold much ink
* For some writers, clip is in the way... for me it works and like it as I can feel for the clip knowing the nib is facing up.
* Very audible click
* Reviews I've read states this pen is not ideal for a long writing session, I don't tend to have long writing sessions but writing a full page was fine.. did not notice anything unconformable about using the pen.";;
1749059567-97;https://www.amazon.com/product-reviews/B005WPTTG4;"This fountain pen writes like a dream and is so nice in the hand.  Since it is retractible I don't worry about carrying this fountain pen in my bag or folio.

I was hesitant to buy this since some reviews said that it is was the cheaper version.  I have verified that in the US they are calling it the Capless.  My nib is 18k with rodium finish, so it is as advertised.

I am so glad that I splurged. This is a wonderful pen to write with, and am always finding reasons to use it.";;
1749059567-98;https://www.amazon.com/product-reviews/B005WPTTG4;"This pen is a workhorse.  Like any fountain pen, you should use it often.  I carry this everyday because of the click feature that makes this pen so accessible.  You just have to get used to rotating the pen when removed the pocket because it is oriented tip up in the pocket.  I got the medium nib which is super smooth. The 18k gold nib glides over the paper.  Its line is thinner that other medium nib pens that I have which I like.  It produces a nice line on notebook paper but I have noticed that copy paper absorbs the ink and so you get a thicker line.  I got the black and gold coloration and it looks good in the pocket.  I have only used the included blue cartridge so far because the ink I ordered has not arrived yet, but it is a nice color and very simple to install.  Basically, you get all the smoothness of a fountain pen with the convenience of a click pen.  Highly recommended!

I will probably buy another one with the red coloration and use it exclusively with red ink.  This pen is that good!";;
1749059567-99;https://www.amazon.com/product-reviews/B005WPTTG4;I like fountain pens but have hesitated purchasing the Pilot Vanishing Point.  For one, it has a small protruding nib when extended, similar to that found on the Lamy 2000, and doesn't provide the eye-hand orientation that keeps the nib properly rotated.  The second issue was its bulk as it is slightly bigger and fatter than pens I use - about the same length as a capped Lamy Safari.  Third, its a metal pen and I tend to like pens that are lighter.  An last, its that shirt clip - how can that be comfortable - I could see myself getting comfortable with the size, weight and small nib but that clip??  So I finally bought one because I enjoy the fine Pilot nibs and I am glad I did.  What a great pen.  The shirt clip doesn't bother me at all and as my fingers straddle it the pen and nib become properly oriented so no skipping.  And while it has some weight and size it is fairly light and comfortably held for long writing sessions.  So where else can you get a great writing nib, in a metal protective shroud, with the convenience of a retractable pen??;;
1749059567-100;https://www.amazon.com/product-reviews/B005WPTTG4;I'm totally in love with this pen. I'll leave the details to the many reviews already done, but had to add my 5 stars to the mix. Beautiful pen. Not as thick as the picture might suggest. Perfectly balanced for my writing style. Well-constructed, good solid feel, but not heavy. Writes like a charm. Just perfect. The click feature to extend and withdraw the nib is genius. Good solid feel. Fun to watch the litle door inside the pen open and close as the nib goes in and out. Keeps me from constantly re-capping when I am not actively writing and fear that the ink flow will dry up. Clips upside down, so you won't forget to retract the nib. Was easy enough to fill with ink using the included converter. the converter is the newer model with a little piece of something inside of it, which is supposed to promote better ink flow. I had bought and returned the LAMY 2000 because of skipping problems with the nib and what I think to be a cheap feel. The pilot vanishing point outscores the LAMY, imho, easily on these issues.;;
1749059567-101;https://www.amazon.com/product-reviews/B005WPTTG4;Wonderful writing experience.  I purchased the fine nib and I love it.  I use the cartridges and haven't filled my pen with a pump.  I figure that I could afford the cartridges if I could afford the pen.  The retractable nib is the game changer for me. As a student, I loved fountain pens and tried to hang on even after the retractable tip ball writer (ball point pen) became the norm.  The retractable tip was just too convenient.  I ended up using a Lamy ball point/mechanical pencil for the last 20 years.  For a period of 4 or 5 years before that, I used a Rotring multicolor pen but went to the Lamy for convenience.  However the chance to use a retractable tip fountain pen could not be passed up after I read the article on pens in the WSJ a few months ago.  It doesn't leak and it is always ready to go..... can you believe it?  Now I'm really happy.  I carry a cheap Kuru Toga mechanical pencil in my briefcase when I need a pencil.;;
1749059567-102;https://www.amazon.com/product-reviews/B005WPTTG4;This is my third Vanishing point pen. It is a phenomenal instrument and I truly enjoy writing with it. It looks good and flows smoothly on most paper using many different types of  Noodlers ink (most commonly Bernenke Blue). It is a five star pen with one exception and that is that I tend to be rough on pens.  Both times the pen was dropped on a steel deck which broke the metal cover at the tip.  Hopefully 3 times is a charm.  It takes a minute to get used to the clip at the bottom but it is what ensures me the pen is in the right position for writing.  I strongly recommend this pen for any user of fine writing instruments.;;
1749059567-103;https://www.amazon.com/product-reviews/B005WPTTG4;"I bought blue vanishing point back in mid-90s and used it every day.  On July 1, 2010, my house was burgled and the pen was stolen.  I finally replaced it this week, and I am so glad I did.  This is a great pen: it writes well, it feels good in your hand, and it is classy in meetings.

The shipping was horrible though.  My first delivery was a medium matte black, which was then replaced with a fine red.  Amazon could not do another replacement, so I had to go through the hassle of a full return and purchase.  Eek.  So a 2 day delivery on prime took over 10 days and trips to Kohls and UPS.";;
1749059567-104;https://www.amazon.com/product-reviews/B005WPTTG4;"First a clarification: do not confuse this with the Pilot Capless Alloy Nib. The Vanishing Point is the same as the Capless, the names are just variants of US branding and older Japanese releases. The difference is in the nib material. Double check the nib, if you ordered a gold plated nib, it will have the engraving ""18k..."" Or ""14k..."" If you ordered the gold plated nib. It is not gold in color unless you ordered something similar. The gold is layered by other materials such as rhodium. If you ordered the alloy nib, then there is a cheaper version of this pen that sells for less than $100. Again, it's all in the nib.

Smoothest writer of all my pens and easiest to engage. I will be ordering another since I liked it that much.";;
1749059567-105;https://www.amazon.com/product-reviews/B005WPTTG4;"we highly recommend,
he is a professional, man, and is doing many important things meetings, and  He was use to a waterman, and what ever the montblonc"" I am not into labels...
well after loosing his other good pen with inscription of his name.....
I purchased for Christmas, What a Pen I mean this..... the color choice is one thing BUT THE NIB RETRACTS,AND DOES NOT DRY OUT OR NEED PRIMING...
IT IS WORTH EVERY PENNY I PAID......
NOW LETS ALL JST GIVE A HOLLAR OUT TO MIKE,
hey honey dont loose this one,cause if you do Ill get a different color, I had gotten him the brownish reddish,so as it shall stand out and less likely  to be grabbed accidentally by a coworker or at what ever...BECAUSE IT IS SO VERY SPECIAL IN CRAFTSMANSHIP AND USAGE.....  HONESTLY, IT IS THE PEN TO HAVE AND GIFT.... YOU WILL NOT BE DISAPPOINTED,
ONE NOTE IS IT DOES NEED THE INK THAT IS JUST FOR IT, SO GET PLENTY WHEN YoU ORDER
HOW ever it does not use allot of ink!

it is so unique, i am very glad i chose such a pen!";;
1749059567-106;https://www.amazon.com/product-reviews/B005WPTTG4;"I really appreciate the unique one-handed retractable click design of this Pilot VP pen for on-the-go note taking. This pen is well made with substantial weight and balance. The clip placement is easily adaptable and acts as a subtle guide for proper nib alignment w/o having to look. The SU (stub) 18k nib, however, writes like a nail on Rhodia 80g paper (less one star). There is a considerable amount of feedback that I wasn't expecting in a gold nib. I have since purchased an extra nib unit in FINE that I also find somewhat toothy. I may use a 12000 grit micro-mesh sheet to smooth out the nibs if they don't work themselves out with further use. All in all, a very convenient design and a definite keeper in my meager collection.

Note:  the newer CON-40 converter was included  :D";;
1749059567-107;https://www.amazon.com/product-reviews/B005WPTTG4;Any time I meet a pen person, I have to show them my pen, and they are amazed and then they try it and seem to love the balance and feel, too. I don't like a giant pen, so this feels really good to me - it's not too heavy, and is very comfortable for hours of writing. And, nifty or not, the retractable feature is just SOOOOOO convenient. There's just something nifty about a retractible fountain pen.  After 6 months, I still love it. It does have a very small reservoir, but I'm ok with that, as I like to change ink colors a lot, anyway. I'm pretty good at tuning fountain pens, but really didn't need to do anything with this one. It writes like a hovercraft - just glides - very smooth - I hardly feel it against the paper, unless the paper is really rough. I can write as quickly or slowly as I want. I think I got extra fine, and am surprised at how fine a line it really will make, if I want. Amazon's price was great, too.;;
1749059567-108;https://www.amazon.com/product-reviews/B005WPTTG4;I purchased the medium nib which writes beautifully smooth and wet, but it writes  broader than other pilot medium fountain pens. The quality of the fountain pen is excellent and it has a nice weight to it.;;
1749059567-109;https://www.amazon.com/product-reviews/B005WPTTG4;Since I received this pen and started writing I have not stopped exclaiming how much I love this pen. I have this with the extra fine nib and just love how it writes. Some reviews talk about the drag or scratchy nature of this nib but for me that’s the beauty of it. I love that feel as the nib moves over the paper as I write and I have not stopped writing since I received this vanishing point fountain pen. It has become my everyday carry. All I can say is I love this pen!;;
1749059567-110;https://www.amazon.com/product-reviews/B005WPTTG4;"When I fist got this pen I got the impression this was the Capless pen, which is the affordable version of the Vanishing point, however if you look at rye nib, you will see a small engrave that reads 18K720 this is standard, the nib for the vanishing point is made of plated gold. The 18k inscription confirms the true identity of the pen.
It was a wild ride looking up all this but this is a nice pen, comes with a refillable cartridge and a spare non-refillable cartridge along with a metal cap.
Worth the money, solid pen, definitely would recommend!";;
1749059567-111;https://www.amazon.com/product-reviews/B005WPTTG4;so, as for some background, i love fountainpens, and have a lamy 2000 and several others. i got this at a bargain price for work. so, the good is that i love the clip and it stays clipped to my polo shirts and is easy to take on and off. no cap to mess with. the nib is super smooth and a pleasure to write with. looks good. unlikely to roll off a desk. the click mechanism is stout and is a pleasure to use. also, very easy to find replacement nibs from various nibmeisters to replace this. i was considering getting a richard binder xxf waverly nib for it for doing document work. overall very user friendly. the bad: not a fan of pens >$50 needing cartridges and converters. but, not sure of how else this pen could have a different fill mechanism though. so, as for capacity, use a finer nib and the cartridges and it seems to last for 2-3 days of heavy use with a medium nib. likely longer with smaller points. overall glad i got it and it is now loaded with noodlers aircorps blue-black and functioning nicely.;;
1749060734-1;https://www.amazon.com/product-reviews/B001AX3SR8;"I already had a Pilot VP with a 18K gold M nib. And I am positively surprised by the writing experience of this alloy F nib. It's smooth, with a good ink flow, and puts down a ""Western"" fine line. The pen itself is a classic looker (dark blue lacquer with a chrome trim), and the clicking mechanism is very satisfying.";;
1749060734-2;https://www.amazon.com/product-reviews/B001AX3SR8;"I prefer buying fountain pens and ink from small retailers. However, this Japanese exclusive is one of the exceptions.
I wanted a retractable fountain pen and due to the EDC nature wanted the steel nib version.
I’m a huge Pilot fan and love their fine <F> nibs. This pen does not disappoint! It is a bit of a dry writer, which is not surprising with a small nib in fine. The notoriously barnacle making Diamine Ancient Copper was too dry, but other inks have worked well, especially the wet Diamine scented Pick Me Up is great in it. I haven’t tried any shimmer inks and probably won’t.";;
1749060734-3;https://www.amazon.com/product-reviews/B001AX3SR8;"A great pen.  It wrote exceptionally well with the included Pilot Black cartridge.  It's fine and dry enough that you can write on cheap paper (eg. Mead notebooks, checks, etc) without feathering or spreading like crazy.  The nib is pretty smooth (especially with a wet, lubricated ink), but not as smooth as a Vanishing Point with a gold <F> nib (which is also a little broader and much wetter).  I use my VP with a gold <F> nib at work where I use Black 'n Red notepads with decent paper, and carry this steel nibbed VP at home and running errands where paper quality will vary.

After I used up the included cartridge, I slapped in a CON-50 and I've been using bottled inks since.  You have to purchase a CON-40, CON-50 or CON-20 converter separately as this pen doesn't come with a converter (unlike the gold-nib VPs that come with a CON-40).";;
1749060734-4;https://www.amazon.com/product-reviews/B001AX3SR8;"I CCV have had several pilot capless pens and there are two classes of them. They are are the listed as callers and retractable. The retractable shave the higher end  nib which are smooth as butter. These nibs are steel with a gold coating and are as smooth as margarine.
They write well on most kinds of paper and are a little stiffer but not that much. Otherwise they are pretty much the same as the more expensive version.
Comes with lots of paper that is written in Chinese so was pretty much useless to me
I used Noodler’s inks as I write a lot on documents that have to be permanent, and tamper proof . Perfect pen for a daily user that won’t break your heart is someone walks with it.";;
1749060734-5;https://www.amazon.com/product-reviews/B001AX3SR8;I've purchased this pen twice for two different people as gifts. High quality. Fun click. Would recommend;;
1749060734-6;https://www.amazon.com/product-reviews/B001AX3SR8;Love this pen and I'm so happy I got it! Don't really care that it's a steel nib. It writes so smoothly. If I ever want to get the gold nib unit, I can always buy it separately.  It would still be less than buying gold nib VP.;;
